Sr No,Date dd/mm/yyyy,Startup Name,Industry Vertical,SubVertical,City  Location,Investors Name,InvestmentnType,Amount in USD,Remarks
1911,02/02/2016,SoundSurround,Technology,Audio Technology Solutions,Mumbai,Multiple investors through Ten Minute Million competition,Seed Funding,"22,500",
1912,03/02/2016,Mazkara,Consumer Internet,Beauty & Wellness Platform,Pune / Dubai,Dunamis Ventures Pte Ltd.,Seed Funding,"10,00,000",
1913,03/02/2016,RoadGods,ECommerce,Auto Spare Parts eTailer,New Delhi,Green House Ventures (GHV),Seed Funding,"1,00,000",
1914,03/02/2016,Pindropmusic,Consumer Internet,Music Discovery Mobile App,Noida,Green House Ventures (GHV),Seed Funding,"1,00,000",
1915,03/02/2016,Woodpie,Consumer Internet,Book Recommendation Service,Bangalore,Ingram Content Group,Seed Funding,"30,000",
1916,04/02/2016,Perfumery,ECommerce,Fragrances & Perfume eTailer,New Delhi,Oranda Global & Others,Seed Funding,"30,000",
1917,05/02/2016,Magic Crate,Education,Children Education Platform,Bangalore,"TV Mohandas Pai, Aarin Capital",Seed Funding,,
1918,05/02/2016,ZenDrive,Technology,Safe Driving Data & Analytics platform,Bangalore / SFO,"Sherpa Capital, Nyca Partners and Thomvest Ventures",Private Equity,"1,35,00,000",
1919,05/02/2016,Smartcooky,ECommerce,Marketplace for Health Foods,New Delhi,"Vandana Luthra,",Private Equity,,
1920,05/02/2016,Turtlemint,Consumer Internet,online personalized insurance platform,Mumbai,Nexus Venture Partners,Private Equity,,
1921,05/02/2016,BHIVE,Real Estate,Workspace Rentals,Bangalore,"Raghunandan G, Venturesity, Arihant Patni",Seed Funding,,
1922,05/02/2016,Gingercrush,Ecommerce,Personalized Products & Merchandize eTailer,Vadodara,"Saha Fund, TV Mohandas Pai, Zia Mody, Mumbai Angels, Ananda Kallugadde, Rakesh Desai, Rakesh Malhotra",Private Equity,"10,00,000",
1923,05/02/2016,American Vision,Consumer Internet,Optical Store Aggregator Platform,Pune,Undisclosed investors,Seed Funding,"81,000",
1924,05/02/2016,DawaiLelo,Consumer Internet,Healthcare Services & Online Pharmacy Mobile App,Varanasi,Undisclosed investors,Seed Funding,"52,000",
1925,06/02/2016,Heads Up For Tails,Ecommerce,Pet Products eTailer,New Delhi,Undisclosed investors,Seed Funding,"10,00,000",
1926,06/02/2016,LiveNutriFit,Healthcare,Weight loss & Healthcare Info portal,New Delhi,"Mohit Goel, Vinod Jain & Others",Seed Funding,,
1927,08/02/2016,Moglix,Ecommerce,Industrial & Home Products Marketplace,New Delhi,Ratan Tata,Private Equity,,
1928,08/02/2016,iStyleYou,Consumer Internet,Personal Fashion Stylist App,Gurgaon,Green House Ventures (GHV),Seed Funding,"1,00,000",
1929,08/02/2016,AdUrCup,Consumer Internet,Ad Network,New Delhi,Green House Ventures (GHV),Seed Funding,"1,00,000",
1930,08/02/2016,Weddingz,Consumer Internet,online marketplace for wedding venues and vendors,Mumbai,Sixth Sense Ventures,Private Equity,,
1931,08/02/2016,Urban Dhobi,Consumer Internet,On Demand Laundry Services,Jaipur,"Vinod Bansal, Sanjeev Singhal",Seed Funding,,
1932,08/02/2016,Gray Routes,Consumer Internet,Last mile logistics solutions,Mumbai,"Mahesh Parasuraman, Rahul Gautam & Others",Seed Funding,,
1933,08/02/2016,Xpressbees,ECommerce,ECommerce Logistics solutions,Pune,"SAIF Partners, IDG Ventures India, Vertex Ventures, Valiant Capital",Private Equity,"1,25,00,000",
1934,08/02/2016,Invictus Oncology,Healthcare,Cancer therapeutic Info & Solutions,New Delhi,Ratan Tata,Private Equity,,
1935,08/02/2016,Hansel.io,Technology,Mobile App Tech Solutions,Bangalore,"Endiya Partners, Mekin Maheshwari, Rajesh Sawhney",Seed Funding,,
1936,09/02/2016,Inc42,Consumer Internet,Startup Focused Media News Portal,New Delhi,"India Ventures, Aarin Capital & Others",Seed Funding,,
1937,09/02/2016,GOQii,Technology,Personalized fitness coaching & Fitness band,Mumbai,Edelweiss Financial Services,Private Equity,,
1938,10/02/2016,Capzest,Consumer Internet,Digital Lending Platform,Mumbai,Lion Ventures,Seed Funding,"2,00,000",
1939,10/02/2016,GlamStudios,Consumer Internet,Online Salon Aggregator,Noida,Aqeel Ahmed,Seed Funding,,
1940,10/02/2016,Affimity,Consumer Internet,Social Networking platform,Bangalore,undisclosed investors,Seed Funding,"12,00,000",
1941,10/02/2016,Anandakanda,Technology,Medicine Intake Reminder System,Pune,undisclosed investors,Seed Funding,"1,50,000",
1942,10/02/2016,JoulestoWatts,Technology,IT services & Talent collaboration services startup,Bangalore,Manipal Global Education Services,Seed Funding,,
1943,10/02/2016,Shopkirana,Consumer Internet,Retailer Supply Chain platform,Indore,"Atul Jain, Anil Gelra, Jaikumar Nair",Seed Funding,,
1944,10/02/2016,Stylofie,Consumer Internet,Online Beauty Parlour search & discovery Platform,Gurgaon,Jaideep Mehta,Seed Funding,,
1945,10/02/2016,OyBob,eCommerce,Hyperlocal Products & Services marketplace,Gurgaon,Sachin Dalal,Seed Funding,,
1946,12/02/2016,ActOnMagic,Technology,Cloud Analytics and Management Products,Bangalore,Jayabalan Subramanian,Seed Funding,"1,25,000",
1947,12/02/2016,Bonhomia,Food & Beverage,premium Tea and Coffee,New Delhi,"Alok Rawat, Grey Orange Robotics",Seed Funding,"10,00,000",
1948,12/02/2016,iGrenEnergi,Technology,Solar Power Solutions,Mumbai,Sunil Mehta,Seed Funding,"10,00,000",
1949,12/02/2016,RKSV,Consumer Internet,Online Stock Trading Platform,Mumbai,Kalaari Capital,Private Equity,"40,00,000",
1950,15/02/2016,Aasaanjobs,Consumer Internet,Online Recruitment Marketplace,Mumbai,"Aspada Advisors, IDG Ventures,\\xc2\\xa0 Inventus Capital",Private Equity,"50,00,000",
1951,15/02/2016,Snapdeal,eCommerce,Horizontal Online Marketplace,New Delhi,Ontario Teachers\\xe2\\x80\\x99 Pension Plan & Others,Private Equity,"20,00,00,000",
1952,15/02/2016,Jugnoo,Consumer Internet,Transportation & On-demand delivery aggregator,Chandigarh,Saumya Tandon,Private Equity,,
1953,15/02/2016,Snapbizz,Technology,Connectivity platform for local grocery stores,Bangalore,Ratan Tata,Private Equity,,
1954,15/02/2016,GoYaNo,Consumer Internet,Events & Restaurant Discovery Marketplace App,Gurgaon,Mukesh Kumar Gupta,Seed Funding,"50,000",
1955,15/02/2016,RentSher,Consumer Internet,Online Household Product Rental platform,Bangalore,"Vaibhav Doshi, Abhay Singhal, Vibhu Garg, Joby Babu, Abhishek Acharya, Manish Shah",Seed Funding,"3,00,000",
1956,15/02/2016,Buddy,Finance,Micro Lending Platform for eCommerce purchases,Bangalore,"Blume Ventures,\\xc2\\xa0 Tracxn Labs",Seed Funding,"5,00,000",
1957,15/02/2016,Legistify,Consumer Internet,Online Legal services platform,New Delhi,Ranjit Singh,Seed Funding,,
1958,16/02/2016,TableHero,Consumer Internet,Dynamic Restaurant Website creator,Bangalore,"GrowX Ventures, Kunal Shah, Sandeep Tandon, Haresh Chawla, Powai Lake Ventures, Globevestor",Seed Funding,"10,00,000",
1959,16/02/2016,BetterPlace,Technology,Data analytics based Verification services Platform,Bangalore,Unitus Seed Fund,Seed Funding,"9,70,000",
1960,16/02/2016,Salebhai,eCommerce,"Sweets, Eatables, Handicrafts Online Marketplace",Ahmedabad,"Virendra Shekhawat, Deepak Chokhani, Yogesh Patel & Others",Seed Funding,,
1961,16/02/2016,icustommadeit,eCommerce,Professional Custom creators Marketplace,Pune,"Brand Capital, Siddhivinayak Skyscrapers, Dinesh R. Challa",Private Equity,"40,00,000",
1962,16/02/2016,Tring,Consumer Internet,Instant Messaging App,Pune,Vishwadeep Bajaj & Others,Seed Funding,,
1963,16/02/2016,Medinfi,Consumer Internet,Doctor & Clinics Discovery platform,Bangalore,"Rajnish Sinha, Prijit Debnath, Kanchan Ghoshal",Seed Funding,,
1964,17/02/2016,Timemytask,Consumer Internet,On-Demand home cleaning services,Mumbai,Lead Angels,Seed Funding,,
1965,17/02/2016,GameZop,Technology,Mobile Gaming Platform,New Delhi,"KWAN Entertainment & Marketing Solutions, Powerhouse Ventures & Others",Seed Funding,"3,50,000",
1966,17/02/2016,Notary Mama,Consumer Internet,On-demand Legal documentation and registration service,Bangalore,"Dr Nandish Domlur, Amit Sandill",Seed Funding,,
1967,17/02/2016,The Viral Fever,Consumer Internet,Independent Online Video production company,Mumbai,Tiger Global,Private Equity,"1,00,00,000",
1968,17/02/2016,Avanti Learning,Education,Private Coaching Classes,New Delhi,Michael & Susan Dell Foundation,Private Equity,"50,00,000",
1969,17/02/2016,Bollant Industries,Technology,Eco-friendly consumer & packaging products,Hyderabad,Ratan Tata,Private Equity,,
1970,18/02/2016,GetVee,Consumer Internet,Matrimony & Couples only mobile platform,New Delhi,"Lightspeed Venture Partners, K Ganesh",Private Equity,,
1971,18/02/2016,HealthKumbh,Consumer Internet,Health related Information portal,Ahmedabad,Undisclosed investor,Seed Funding,"73,000",
1972,18/02/2016,Unlaze,Consumer Internet,Social Networking app for outdoor interests,Gurgaon,"Sujal Shah, Dino Morea",Seed Funding,,
1973,18/02/2016,Tracxn,Technology,Indian Startup ecosystem trends analyzer & funding platform,Bangalore,"Nandan Nilekani, Mohandas Pai, Neeraj Arora, Anand Rajaraman, Girish Mathrubootham, Aneesh Reddy & Teruhide Sato",Private Equity,,
1974,18/02/2016,Careongo,ECommerce,Online Pharmacy store,New Delhi,Farooq Oomerbhoy & Other angel investors,Seed Funding,"3,00,000",
1975,18/02/2016,Ark Robot,Technology,Warehouse Automation,Bangalore,Qualcomm (Through QPrize Contest),Seed Funding,"3,50,000",
1976,19/02/2016,Jaypore,ECommerce,Ethnic Products marketplace,New Delhi,Aavishkaar,Private Equity,"50,00,000",
1977,19/02/2016,Finance Buddha,Consumer Internet,Online Loan Comparison & Discovery platform,Bangalore,Chennai Angels,Seed Funding,,
1978,19/02/2016,AlmaConnect,Consumer Internet,Alumni social network,New Delhi,"Mohandas Pai, Varun Aggarwal",Seed Funding,,
1979,19/02/2016,Advantage Club,Consumer Internet,mobile platform for corporate employee benefits,Gurgaon,Purvi Ventures & Others,Seed Funding,"4,00,000",
1980,19/02/2016,LocalRamu,Consumer Internet,mobile based aggregator for local service providers,Bangalore,3 undisclosed investors,Seed Funding,,
1981,22/02/2016,Baby Berry,Consumer Internet,Parenting Mobile app,Bangalore,Nitin Bagmane & Other undisclosed investors,Seed Funding,"10,00,000",
1982,22/02/2016,Magicpin,Consumer Internet,Hyperlocal Discover Mobile App,New Delhi,Lightspeed India,Private Equity,"30,00,000",
1983,22/02/2016,First Eat,Consumer Internet,Healthy Food Delivery platform,New Delhi,Undisclosed investor,Seed Funding,"1,00,000",
1984,22/02/2016,SigTuple,Technology,Healthcare based Tech Solutions,Bangalore,"Sachin Bansal, Binny Bansal, Accel Partners & Others",Seed Funding,,
1985,22/02/2016,Taskbob,Consumer Internet,Hyperlocal Handyman services platform,Mumbai,"IvyCap Ventures, Orios Venture Partners, Mayfield India",Private Equity,"45,00,000",
1986,22/02/2016,Styledotme,Consumer Internet,Mobile Fashion App,New Delhi,Indian Angel Network,Seed Funding,"37,000",
1987,22/02/2016,NewsLaundry,Consumer Internet,Independent News Media Portal,New Delhi,"Omidyar Network,\\xc2\\xa0 Vikram Lal, Abhijit Bhandari, Mahesh Murthy, Shashank Bhagat",Private Equity,,
1988,23/02/2016,CupoNation,Consumer Internet,Deals and Discount platform,Gurgaon,"Rocket Internet AG, Holtzbrink Ventures, New Enterprise Associates (NEA), e.ventures, ru-Net, Deutsche Telekom Strategic Investments (DTSI), Silicon Valley Bank",Private Equity,"1,10,00,000",
1989,23/02/2016,Aarav UAV,Technology,unmanned aerial vehicles creator,Kanpur,"StartupXseed Ventures, The Phoenix Fund and others",Seed Funding,,
1990,24/02/2016,Sayfix,Consumer Internet,Hyperlocal Home Services Provider,Bangalore,Yajnanarayana Kammaje,Seed Funding,"1,60,000",
1991,24/02/2016,LoanZen,Consumer Internet,Peer to peer Lending marketplace,Bangalore,Tracxn Syndicate,Seed Funding,,
1992,24/02/2016,NoBroker,Consumer Internet,Peer to peer property listing platform,Bangalore,"Beenext, Digital Garage, Beenos, Qualgro, Mamoru Taniya, SAIF Partners",Private Equity,"1,00,00,000",
1993,24/02/2016,AppilyEver,Consumer Internet,Online wedding services marketplace,Hyderabad,"Varun Aggarwal, Suresh Venkat, Raj Y",Seed Funding,"4,00,000",
1994,24/02/2016,Pocketin,Consumer Internet,Hotel reservations & Deal platform,Noida,Swastika Company Ltd,Seed Funding,"1,50,000",
1995,24/02/2016,FeetApart,Consumer Internet,Employee engagements & Rewards platform,Bangalore,Vishal Bali & Others,Seed Funding,,
1996,25/02/2016,OfBusiness,eCommerce,B2B commerce Marketplace,Gurgaon,Matrix Partners India,Private Equity,"50,00,000",
1997,25/02/2016,CarveNiche,Consumer Internet,Personalized Learning Solutions & products,Bangalore,"Calcutta Angels, Lead Angels & Others",Seed Funding,,
1998,25/02/2016,Juspay,Consumer Internet,Digital Payments solutions,Bangalore,"Accel Partners, Ashish Hemrajani, Parikshit Dar, Rajesh Balpande",Private Equity,"58,00,000",
1999,25/02/2016,Funcart,eCommerce,Party Supplies Etailer,New Delhi,Undisclosed HNIs,Seed Funding,"70,000",
2000,26/02/2016,Freedom Smart Labs,Technology,IoT retail solutions,New Delhi,Kapil Goel,Seed Funding,"1,45,000",
2001,26/02/2016,EduBridge,Consumer Internet,Skill development and vocational training platform,Mumbai,"Insitor Impact Asia Fund, Acumen Fund",Private Equity,"25,00,000",
2002,29/02/2016,Nestaway,Consumer Internet,Online Home Rental Marketplace,Bangalore,Ratan Tata,Private Equity,,
2003,29/02/2016,Hopscotch,eCommerce,Baby & Kids Products Online Flash sales platform,Mumbai,Eduardo Saverin,Private Equity,"1,30,00,000",
2004,29/02/2016,PinClick,Consumer Internet,Online real estate listings,Bangalore,Undisclosed investors,Private Equity,,
2005,01/01/2016,Smartcooky,ECommerce,Health Food / Personal Care Marketplace,New Delhi,"Rajan Anandan, Pramod Bhasin, Siddharth Pai, TV Mohandas Pai, Manvinder Singh Banga",Seed Funding,,
2006,01/01/2016,Helpi,Consumer Internet,On Demand Cleaning Services Mobile App,Mumbai,Undisclosed Investors,Seed Funding,,
2007,04/01/2016,DogSpot,ECommerce,Online Pet Store,Gurgaon,Ratan Tata,Seed Funding,,
2008,04/01/2016,Career360,Education,College Education Portal,New Delhi,MeritTrac,Private Equity,,
2009,04/01/2016,B9 Beverages,Food & Beverage,Craft Beer manufacturing company,New Delhi,"Sequoia Capital, Kunal Bahl, Rohit Bansal, Deepinder Goyal, Ashish Dhawan, Mayank Singhal",Private Equity,"60,00,000",
2010,05/01/2016,WIMWI Foods,Food & Beverage,Healthy food manufacturing & sales startup,Ahmedabad,Centre for Innovation Incubation and Entrepreneurship (CIIE),Seed Funding,,
2011,05/01/2016,MyChild App,Education,Child Disorder Information & Education,Bhopal,"Samir Bangara, Anisha Mittal, Amit Gupta, Pallav Nadhani, Lalit Mangal, Arihant Patni, Dr. Ritesh Malik, Deobrat Singh, Saurab Paruthi, Singapore Angel Network.",Seed Funding,"1,00,000",
2012,05/01/2016,Instaproc,ECommerce,B2B Procurement Marketplace for Office Products,Noida,Dinesh Agarwal,Seed Funding,,
2013,05/01/2016,360Ride,Consumer Internet,Ride Sharing platform,Bangalore,Undisclosed,Seed Funding,"1,50,000",
2014,05/01/2016,Alef\\nMobitech,Consumer Internet,Cloud Mobility Solutions,Mumbai,Tata Capital Innovation Fund,Private Equity,"50,00,000",
2015,06/01/2016,Tracxn,BFSI,Startup Funding Deal Discovery & Execution platform,Bangalore,Ratan Tata,Seed Funding,,
2016,06/01/2016,Qdesq,Real Estate,Branded Workspaces Aggregator,Gurgaon,"Dheeraj Jain, Jagdish Kumar, Bharat Gupta, Ankush Saigal, Praveen Saini",Seed Funding,,
2017,06/01/2016,Sensara,Technology,"TV Search, Guide and Remote mobile app",Bangalore,"Lalitesh Katragadda,\\xc2\\xa0 Ganayantrika Systems",Seed Funding,"7,50,000",
2018,06/01/2016,Zebpay,Consumer Internet,Bitcoin Buying & Selling Mobile App,Ahmedabad,"Arjun Handa, Amit Jindal, Nagendra Chaudhary",Private Equity,"10,00,000",
2019,06/01/2016,PlanMy\\nMedicalTrip,Healthcare,Medical Tourism platform,Pune,"Bhanu Vikram Parsotam, Rohan Desai and Paras Patel",Seed Funding,"1,50,000",
2020,06/01/2016,MyCity4Kids,Education,Children Education & Information platform,Gurgaon,"SIDBI Venture Capital Limited, YourNest Angel Fund",Private Equity,"30,00,000",
2021,06/01/2016,Justdakhila.com,Education,School Student admissions platform,New Delhi,Ankur Gupta,Seed Funding,"7,50,000",
2022,07/01/2016,PitStop,Consumer Internet,Automobile Service Booking App,Bangalore,Myntra/LivSpace Founders,Seed Funding,,
2023,07/01/2016,Bikxie,Consumer Internet,Two Wheeler Taxi Service,Gurgaon,Undisclosed Investors,Seed Funding,,
2024,07/01/2016,Infurnia,Consumer Internet,Online Furniture Customization platform,Bangalore,Idein Ventures,Seed Funding,"1,60,000",
2025,07/01/2016,Myly,Education,Mobile Based Education platform,Jaipur,Newbie Promoter Pvt Ltd,Seed Funding,"1,00,000",
2026,07/01/2016,MakeMyTrip,Consumer Internet,Online Travel/Hotel Booking platform,Gurgaon,Ctrip.com International Ltd,Private Equity,"18,00,00,000",
2027,08/01/2016,Melorra,ECommerce,Online/ Mobile Jewellery Retailer,Bangalore,Lightbox Ventures,Private Equity,"50,00,000",
2028,08/01/2016,ConfirmTKT,Consumer Internet,Train PNR Status Prediction Platform,Bangalore,"Krishna Jhujhunwala, Dr. Apoorv Ranjan Sharma, Anirudh Damani, Anand Ladsariya, Sanjay Mehta & Others",Seed Funding,"2,50,000",
2029,08/01/2016,Gyaanzone,Education,Career Planning and Education Advisory Platform,Mumbai,GBIM Technologies Pvt Ltd,Seed Funding,"45,000",
2030,08/01/2016,FlatFurnish,Consumer Internet,Online Furnishing Rental Platform,Gurgaon,Arun Chandra Mohan,Seed Funding,,
2031,09/01/2016,Lumiere,ECommerce,Organic Food eTailer,Bangalore,Undisclosed investors,Private Equity,,
2032,11/01/2016,Koovs,ECommerce,Online Fashion Apparel Retailer,Gurgaon,"Nahata Family, Waheed Alli",Private Equity,"54,00,000",
2033,11/01/2016,Wishup,Consumer Internet,Mobile app based Concierge Service,New Delhi,"500 Startups, Mato Peric, TracxnLabs",Seed Funding,,
2034,11/01/2016,FreshMenu,Consumer Internet,Online / Mobile Food Ordering platform,Bangalore,"Zodius Capital, Lightspeed Venture Partners",Private Equity,"1,65,00,000",
2035,11/01/2016,SavvyMob,ECommerce,Last Minute Hotel Bookings mobile marketplace,Bangalore,"TV Mohandas Pai, LetsVenture",Seed Funding,"10,00,000",
2036,11/01/2016,Fashionablyin,Consumer Internet,Mobile based Geo-target Fashion Marketplace,Mumbai,Ranjan Mahtani,Seed Funding,,
2037,12/01/2016,Shopclues,ECommerce,ECommerce Marketplace,Gurgaon,"GIC, Tiger Global Management, Nexus Venture Partners",Private Equity,"10,00,00,000",
2038,12/01/2016,Hike Messenger,Consumer Internet,P2P Messaging Service,New Delhi,"Matt Mullenweg, Adam D\\xe2\\x80\\x99Angelo, Aditya Agarwal,\\xc2\\xa0 Ruchi Sanghvi & Others",Private Equity,,
2039,12/01/2016,iBus Networks,Technology,Next Generation in-building connectivity,Bangalore,"Vallabh Bhanshali, N Squared Management LLC, Jagdish & Sandeep Mehta Family Office",Private Equity,"23,00,000",
2040,12/01/2016,Happy2Refer,Consumer Internet,Mobile based Referral Platform,Mumbai,"Equity Crest, Vinners, Sparknext",Seed Funding,"2,50,000",
2041,13/01/2016,CarTrade,Consumer Internet,Auto Classifieds Portal,Mumbai,"Temasek Holdings, March Capital, Warburg Pincus",Private Equity,"14,50,00,000",
2042,13/01/2016,Rentomo,Consumer Internet,peer-to-peer renting Marketplace,Bangalore,Shiva Ashok & Other unnamed investors,Seed Funding,"1,00,000",
2043,13/01/2016,Roder,Consumer Internet,inter-city cab aggregator,New Delhi,Unicorn India Ventures,Seed Funding,"2,40,000",
2044,13/01/2016,Bucker,Consumer Internet,Food Ordering Mobile App,Hyderabad,"50k Ventures, Munish Jauhar, Pulkit Jain, Rohit Narang",Seed Funding,,
2045,13/01/2016,Care24,Healthcare,Professional Health Services Platform,Mumbai,"SAIF Partners, India Quotient",Private Equity,"40,00,000",
2046,13/01/2016,Obino,Healthcare,Weigh Loss Coaching,Mumbai,RoundGlass Partners,Private Equity,,
2047,14/01/2016,Snapshopr,Consumer Internet,Visual Search & Image Recognition Platform,Bangalore,Amod Malviya,Seed Funding,,
2048,14/01/2016,Buildkar,ECommerce,Construction Material Marketplace,Bangalore,"Mustafa Wajid, Umang Kumar & Others",Seed Funding,,
