Sr No,Date dd/mm/yyyy,Startup Name,Industry Vertical,SubVertical,City  Location,Investors Name,InvestmentnType,Amount in USD,Remarks
2991,02/01/2015,VioletStreet,,,,"Venkat Vallabhneni, Sudhakar Reddy, Srinivasa Rao Paturi",Seed\\nFunding,"3,15,000",
2992,05/01/2015,Lookup,,,,"DeNA Co., Japan & Teruhide Sato (in Addition to MKS Switzerland & Kris GopalKrishnan)",Seed\\nFunding,"3,80,000",
2993,05/01/2015,#Fame,,,,TO THE NEW Ventures,Private Equity,"1,00,00,000",
2994,05/01/2015,Gympik,,,,"Tom Clausen, Rohan Ajila, Haldyn Glass",Seed Funding,"1,35,000",
2995,06/01/2015,Near.in,,,,"Anupam Mittal, Manish Vij, Prashant Tandon, Gaurav Agarwal, Akash Agarwal, Himanshu Aggarwal, Kevin Parikh",Seed Funding,"2,85,000",
2996,06/01/2015,Purplle.com,,,,IvyCap Ventures,Private Equity,,
2997,06/01/2015,NumberMall,,,,SRI Capital,Private Equity,"1,00,00,000",
2998,06/01/2015,Tookitaki,,,,"Jungle Ventures, Redbright Partners, Blume Ventures",Private\\nEquity,"10,00,000",
2999,06/01/2015,Frankly,,,,Matrix Partners,Seed Funding,"6,00,000",
3000,07/01/2015,Faircent,,,,"Devesh Sachdev, Ashish Tiwari",Seed Funding,,Valuation at $4M
3001,07/01/2015,Nurturey,,,,Seedrs Crowd funding platform,Crowd funding,"1,25,000",
3002,07/01/2015,Bewakoof,,,,"Rohit Bansal, Kunal Bahl, Nikhil Vora",Seed Funding,,
3003,07/01/2015,Stridalyzer,,,,Kickstarter,Crowd Funding,"30,768",
3004,07/01/2015,Commonfloor,,,,Google Capital,Private Equity,"50,00,000",3rd Round
3005,09/01/2015,Sokrati,,,,"IvyCap Ventures, Inventus Capital",Private Equity,,Series B
3006,09/01/2015,YepMe,,,,"JS Capital, Helion Venture Partners, Capricorn Investment Group",Private Equity,"1,30,00,000",Series A
3007,09/01/2015,TapCibo,,,,Alok Goel,Seed Funding,,
3008,12/01/2015,Verayu,,,,"GWB Group, Blume Ventures",Private Equity,,
3009,12/01/2015,MyDreamStore,,,,Undisclosed Investors,Seed Funding,"2,90,000",
3010,13/01/2015,AppVirality,,,,"Rajan Anandan, Mike Galgon, Ashim Mehra, Mohit Saxena, Ravi Gururaj, TNN Capital & IIG",Seed Funding,,
3011,14/01/2015,RateGain,,,,TA Associates,Private Equity,"5,00,00,000",
3012,15/01.2015,Wishberry,,,,"Rajan Anandan, Shankar Mahadevan, Deep Kalra & Others",Seed Funding,"6,50,000",
3013,16/01/2015,eKincare,,,,Adroitent Pvt. Ltd.,Seed Funding,"1,61,000",
3014,18/01/2015,ShopClues,,,,Tiger Global & Other investors,Private Equity,"10,00,00,000",More Details
3015,19/01/2015,Refiral,,,,Cogent E Services,Seed Funding,"3,30,000",
3016,19/01/2015,Ping Digital,,,,Consortium of Angel Investors,Seed Funding,,
3017,19/01/2015,HealthyWorld.in,,,,Group of Angel Investors,Seed Funding,"2,00,000",
3018,19/01/2015,Hostel Dunia,,,,Hyderabad Angels (at Startup Heroes event),Seed Funding,"16,000",
3019,19/01/2015,Play your sport,,,,Hyderabad Angels (at Startup Heroes event),Seed Funding,"16,000",
3020,19/01/2015,Yo Grad,,,,Hyderabad Angels (at Startup Heroes event),Seed Funding,"16,000",
3021,19/01/2015,Enabli,,,,Hyderabad Angels (at Startup Heroes event),Seed Funding,"16,000",
3022,19/01/2015,CBS,,,,Hyderabad Angels (at Startup Heroes event),Seed Funding,"16,000",
3023,20/01/2015,Hopscotch,,,,Eduardo Saverin & Velos Capital,Private Equity,"1,10,00,000",
3024,20/01/2015,Amagi Media Labs,,,,Premji Invest & Mayfield Fund,Private Equity,,
3025,20/01/2015,HealthyWorld.in,,,,Group of Angel Investors,Seed Funding,"2,00,000",
3026,21/01/2015,Simplilearn,,,,"Mayfield India, Kalaari Capital, Helion Ventures",Private Equity,"1,47,50,000",
3027,21/01/2015,MyDreamStore,,,,Undisclosed Investors,Seed Funding,"3,25,000",
3028,21/05/2015,Knit,,,,"Rohit Jain, Amit Rambhia & Others",Seed Funding,,
3029,21/05/2015,Villgro,,,,Michael & Susan Dell Foundation,Seed Funding,"32,50,000",To fund edu startups
3030,22/01//2015,Corporate360,,,,Group of Angel Investors,Seed Funding,"2,00,000",
3031,22/01/2015,Freshmonk,,,,"August Capital Partners, Michael Blakey",Seed Funding,,
3032,22/01/2015,Englishleap.com,,,,ANALEC,Private Equity,,Majority Stake
3033,22/01/2015,Antuit,,,,"Goldman Sachs, Zodius Capital",Private Equity,"5,60,00,000",
3034,22/01/2015,Caratlane.com,,,,Tiger Global,Private Equity,"3,10,00,000",Series D
3035,24/01/2015,Aasaanjobs,,,,"Inventus Capital Partners, IDG Ventures",Seed Funding,"15,00,000",
3036,24/01/2015,Impartus,,,,Kaizen Private Equity,Private Equity,,Series A
3037,25/01/2015,Thrill App,,,,People Group (Shaadi.com),Private Equity,"10,00,000",Strategic Funding
3038,27/01/2015,CarDekho.com,,,,"Hillhouse Capital, Tybourne Capital",Private Equity,"5,00,00,000",Series B
3039,28/01/2015,Grabhouse.com,,,,"Kalaari Capital, Sequoia Capital",Private Equity,"25,00,000",Series A
3040,29/01/2015,Printvenue,,,,Asia Pacific Internet Group,Private Equity,"45,00,000",
3041,29/01/2015,Graphene,,,,KARSEMVEN Fund,Private Equity,"8,25,000",Govt backed VC Fund
3042,30/01/2015,Mad Street Den,,,,"Exfinity Fund, GrowX Ventures.",Private Equity,"15,00,000",
3043,30/01/2015,Simplotel,,,,MakeMyTrip,Private Equity,,"Strategic Funding, Minority stake"
3044,31/01/2015,couponmachine.in,,,,UK based Group of Angel Investors,Seed Funding,"1,40,000",
