Sr No,Date dd/mm/yyyy,Startup Name,Industry Vertical,SubVertical,City  Location,Investors Name,InvestmentnType,Amount in USD,Remarks
1728,25/05/2016,Arcatron Mobility,Technology,Mobility Devices for differently abled,Pune,Sudhir Mehta,Seed Funding,"1,00,000",
1729,25/05/2016,SheThePeople,Consumer Internet,Digital platform for Women,New Delhi,Anand Mahindra,Seed Funding,,
1730,26/05/2016,Cleartax,Consumer Internet,Online Income Tax Filing platform,Bangalore,"FF Angel, Sequoia Capital",Private Equity,"20,00,000",
1731,26/05/2016,Consure Medical,Healthcare,Medical Devices Kit manufacturer,New Delhi,"Accel Partners, Indian Angel Network, India Innovation Fund India Venture Partners",Private Equity,,
1732,26/05/2016,mChamp,Consumer Internet,Celebrity Entertainment Contest App,New Delhi,MoMagic Technologies,Seed Funding,"4,75,000",
1733,27/05/2016,Pianta,Consumer Internet,Online healthcare service discovery platform,Bangalore,"Kunal Shah, Sandeep Tandon",Seed Funding,,
1734,30/05/2016,Vahanalytics,Technology,Safe driving Analytics platform,Mumbai,"Anirudh Damani, Vikram Lakhotia",Seed Funding,"2,00,000",
1735,31/05/2016,Play Your Sport,Consumer Internet,Location based Sports & Fitness Discovery App,New Delhi,Ashish Gupta and other undisclosed investors,Seed Funding,,
1736,31/05/2016,Koovs,eCommerce,Apparel & Lifestyle eTailer,New Delhi,HT Media Ltd,Private Equity,"44,00,000",
1737,31/05/2016,CCavenue,Consumer Internet,Payment Gateway,Mumbai,NSI Infinium Global Pvt. Ltd,Private Equity,"89,00,000",
1738,31/05/2016,1mg,eCommerce,Online Pharmacy,Gurgaon,HBM Healthcare Investments,Private Equity,,
1739,31/05/2016,Tpot,Food & Beverage,QSR Chain,Gurgaon,Ashish Gupta,Seed Funding,,
1740,31/05/2016,MachaDalo,Consumer Internet,Hyperlocal Advertising Platform,Mumbai,Undisclosed Investors,Seed Funding,"1,75,000",
1741,01/04/2016,Dil Mil,Consumer Internet,Matchmaking Mobile App,SFO / Bangalore,"Nelstone Ventures, Transmedia Capital, Maiden Lane Ventures, CSC Upshot & Angel investors",Private Equity,"27,00,000",
1742,01/04/2016,PicsDream,Consumer Internet,Online Marketplace for Photographers,Delhi,Raman Roy,Seed Funding,,
1743,01/04/2016,Process 9,Consumer Internet,online translation and transliteration,Gurgaon,"Indian Angel Network, Alok Sharma, Kris Gopalakrishnan, Saurabh Srivastava, and Ajai Chowdhry",Seed Funding,,
1744,04/04/2016,Housing,Consumer Internet,Real Estate Portal,Mumbai,Vineet Singh,Private Equity,,
1745,04/04/2016,Roll Mafia,Food & Beverage,Rolls & Biryanis QSR chain,Pune,Equentia Natural Resource & Other undisclosed investors,Seed Funding,,
1746,04/04/2016,Hungama,Consumer Internet,Digital Media Entertainment Portal,Mumbai,Xiaomi Inc,Private Equity,"2,50,00,000",
1747,04/04/2016,Highway Delite,Consumer Internet,Various Highway Help Services,Bangalore,N.S. Raghavan Centre for Entrepreneurial Learning,Seed Funding,,
1748,05/04/2016,Cult Fitness,Healthcare,Healthcare training programs,Bangalore,Mukesh Bansal,Seed Funding,,
1749,05/04/2016,Haptik,Technology,Personal Assistant App,Mumbai,Times Internet Ltd,Private Equity,,
1750,05/04/2016,Servify,Consumer Internet,Gadget & Appliances Service App,Mumbai,"Blume Ventures, Barkawi Holdings GmbH, TM Service Technology Holdings GmbH",Private Equity,,
1751,06/04/2016,Shipsy,Logistics,Logistics Solutions,Gurgaon,DTDC Express Ltd,Private Equity,"10,00,000",
1752,06/04/2016,gear6,Consumer Internet,Online bike service and repairs platform,Bangalore,Ninestarter,Seed Funding,"5,00,000",
1753,06/04/2016,MyGlamm,Consumer Internet,Mobile based on-demand Beauty Services platform,Mumbai,L\\xe2\\x80\\x99Occitane,Private Equity,"60,00,000",
1754,06/04/2016,Petoo,Consumer Internet,Online Food Delivery Platform,Bangalore,Axilor Ventures,Private Equity,"10,00,000",
1755,07/04/2016,Truly Social,Consumer Internet,Mobile Gaming Studio,London,Nazara Technologies Pvt Ltd,Private Equity,,
1756,08/04/2016,Little Black Book,Consumer Internet,"Curated Food, event & Lifestyle guide",New Delhi,"IDG, Indian Angel Network",Seed Funding,,
1757,08/04/2016,Vahan,Education,Mobile Education Platform,Chennai,Villgro,Seed Funding,,
1758,08/04/2016,imedilane,Consumer Internet,Online Health Diagnosis platform,New Delhi,"Mahendra Patel, Nilender Chauhan",Seed Funding,"40,000",
1759,11/04/2016,Living Local,Consumer Internet,Social discovery platform,Mumbai,Rattan Chadha,Seed Funding,"2,00,000",
1760,11/04/2016,Vegfru,eCommerce,Online Fruit & Vegetable Marketplace,New Delhi,Wingify,Seed Funding,,
1761,11/04/2016,Oyo,Consumer Internet,Online Branded Budget Room Booking Service,New Delhi,"Softbank, Sequoia Capital, Lightspeed Venture Partners, Greenoaks Capital, DSG Consumer Partners and Venture Nursery",Private Equity,"10,00,00,000",
1762,11/04/2016,PriceRaja,Consumer Internet,Price Comparison Portal,Gurgaon,Prashant Puri,Seed Funding,"3,00,000",
1763,12/04/2016,MagicX,Consumer Internet,On-Demand Task Management App,Bangalore,"Kris Gopalakrishnan, Dr. Ranjan Pai",Seed Funding,"10,00,000",
1764,12/04/2016,Happydemic,Consumer Internet,Artist Discovery & Booking platform,Mumbai,Shaan,Seed Funding,,
1765,12/04/2016,LenDenClub,Finance,Peer-to-Peer Lending Platform,Mumbai,"Anirudh Damani, Daud Ali, Narendra Karnavat, Vikas Kapoor, Vikram Lakhotia, Krishna Jhunjhunwaala, Jayesh Shah",Seed Funding,,
1766,12/04/2016,Indi.com,Consumer Internet,Video Social Network,,Anil Kapoor,Seed Funding,,
1767,13/04/2016,Legalraasta,Consumer Internet,Online legal Services for Startups,New Delhi,"Pravin Khandelwal, Yatin Kumar Jain",Seed Funding,"10,00,000",
1768,13/04/2016,RainCan,Consumer Internet,Subscription-based grocery delivery Mobile App,Pune,Dr. Aniruddha Malpani,Seed Funding,"1,50,000",
1769,13/04/2016,Hippily,eCommerce,Fashion ECommerce App,Mumbai,"Dr. Sridhar Ramaswamy, Rakesh Mathur",Seed Funding,"2,50,000",
1770,13/04/2016,kredX,eCommerce,Invoice discounting\\xc2\\xa0 Marketplace,Bangalore,"Prime Venture Partners,",Seed Funding,"7,50,000",
1771,14/04/2016,Wedwise,Consumer Internet,Wedding related services community,New Delhi,StartUp Equity Partners,Seed Funding,,
1772,14/04/2016,BeaconsTalk,Technology,contextual mobile advertising,Mumbai,"Rajeev Agrawal, Prashant Gooty",Seed Funding,"1,00,000",
1773,15/04/2016,Deal 4Loans,Consumer Internet,Loan Comparison Portal,Noida,"Ram Shriram, Neeraj Arora, Puru Vashishtha",Seed Funding,,
1774,15/04/2016,RenewBuy,Consumer Internet,Online Car & Bike Insurance Comparison portal,New Delhi,Mount Nathan Advisors,Seed Funding,"10,00,000",
1775,15/04/2016,Blue Box Media,Consumer Internet,Online Tech Portals,Jaipur,"Mahavir Pratap Sharma, Ajay Data, Yogesh Chaudhary, Sanjay Phophaliya, Siddharth Agarwal, Kamal Kothari",Seed Funding,,
1776,15/04/2016,Vyomo,Consumer Internet,On-Demand Beauty Service provider,New Delhi,Naturals Salon Chain,Private Equity,"1,50,00,000",
1777,15/04/2016,Organicshop,eCommerce,Marketplace for organic products,Jaipur,"Vivek Nathani, Yogesh Chaudhary, Mahavir Pratap Sharma, Kamal Kothari, H C Jain",Seed Funding,,
1778,15/04/2016,MInd Your Fleet,Consumer Internet,Car Rental Software,Noida,Undisclosed Investors,Seed Funding,,
1779,15/04/2016,NestAway,Consumer Internet,Furnished Home Rental Platform,Bangalore,Tiger Global,Private Equity,"3,00,00,000",
1780,15/04/2016,Tapchief,Consumer Internet,Expert Advice Platform,Bangalore,Vijay Shekhar Sharma,Seed Funding,"1,50,000",
1781,18/04/2016,Rapido,Consumer Internet,Bike Aggregator App,Bangalore,"Pawan Munjal, AdvantEdge Partners, Astarc Ventures",Private Equity,,
1782,18/04/2016,Yufta,eCommerce,Women\\xe2\\x80\\x99s Fashion ECommerce Portal,Bangalore,Ajay Data & other HNIs,Seed Funding,,
1783,18/04/2016,Smytten,eCommerce,Online Discovery and Shopping Platform,Gurgaon,Rajan Anandan,Seed Funding,,
1784,18/04/2016,Houssup,Consumer Internet,interior design and home furnishing portal,Jaipur,"Mitin Patel, Gaurav Agarwal",Seed Funding,,
1785,18/04/2016,Jugnoo,Consumer Internet,On-demand Delivery & Logistics platform,Chandigarh,Paytm & existing investors,Private Equity,"1,00,00,000",
1786,18/04/2016,Tork Motocycles,Auto,Electric Motorcycle Manufacturer,Pune,"Bhavish Aggarwal, Ankit Bhati",Seed Funding,,
1787,19/04/2016,Betaout,eCommerce,customer intelligence and marketing automation platform,Noida,"Stanford Angels, LetsVenture, Chennai Angels, Hyderabad Angels, Mumbai Angels",Private Equity,"15,00,000",
1788,19/04/2016,DriversCart,Consumer Internet,on-demand chauffeur provider,Chennai,ah! Ventures,Seed Funding,"4,50,000",
1789,19/04/2016,LensKart,eCommerce,Eyewear etailing platform,New Delhi,Ratan Tata,Private Equity,,
1790,19/04/2016,CollegeDekho,Consumer Internet,College & Student information platform,New Delhi,Man Capital,Private Equity,"20,00,000",
1791,19/04/2016,OYOfit,Consumer Internet,Fitness Services Aggregator platform,Bangalore,RN Agarwal,Seed Funding,,
1792,19/04/2016,Oliveboard,Consumer Internet,Online exam practice & preparation platform,Bangalore,India Educational Investment Fund,Private Equity,,
1793,19/04/2016,Simplilearn,Consumer Internet,Online certification platform,Bangalore,Brand Capital,Private Equity,,
1794,20/04/2016,1mg,eCommerce,Online Pharmacy,Gurgaon,"Maverick Capital Ventures, Sequoia Capital, Omidyar Network",Private Equity,"1,50,00,000",
1795,20/04/2016,Fashalot,Consumer Internet,Fashion and Store discovery mobile app,New Delhi,"YourNest Angel Fund, Rajul Garg",Seed Funding,,
1796,20/04/2016,Broomberg,Consumer Internet,Cleaning Services Provider,New Delhi,Undisclosed Angel investors & HNIs,Seed Funding,,
1797,21/04/2016,m.paani,Consumer Internet,Loyalty rewards platform,Mumbai,"Blume Ventures, Adil Allana, Aprameya Radhakrishna, Gautam Ivatury, Signal Point Partners",Seed Funding,,
1798,21/04/2016,Yufta,eCommerce,hyperlocal fashion retail platform,Jaipur,Ajay Data & undisclosed HNIs,Seed Funding,,
1799,21/04/2016,mishTag,Consumer Internet,"Style, Fashion Discovery Mobile app",New Delhi,"M&Y Partners, SVG Media, Anthil Ventures & others",Seed Funding,,
1800,21/04/2016,Advanced Structures India,Auto,Automotive Design and Engineering company,Bangalore,GirnarSoft,Private Equity,,
1801,22/04/2016,Licious,eCommerce,Mobile based Meat ordering App,Bangalore,Mayfield India II Management Ltd,Private Equity,"30,00,000",
1802,22/04/2016,Knolskae,Consumer Internet,Educational Gamification & Simulation platform,Bangalore,"Inventus Capital Partners, HR Fund",Private Equity,,
1803,22/04/2016,Druva,Technology,Converged Backup & Data Protection Solutions for Enterprises,Pune,"NTT Finance, Telephone Corporation",Private Equity,,
1804,22/04/2016,TOKO Innovation Studios,Consumer Internet,Children\xe2\x80\x99s Entertainment Games & Products,New Delhi,Indian Angel network,Seed Funding,"4,50,000",
1805,25/04/2016,Commut,Consumer Internet,Shuttle Service Provider,Hyderabad,50K Ventures,Seed Funding,"2,00,000",
1806,25/04/2016,intouchapp,Consumer Internet,Contact Management Mobile App,Pune,Blume Ventures,Seed Funding,,
1807,25/04/2016,Dropkaffe,Food & Beverage,Ready-to-Drink Beverage Producer,Bangalore,"GrowthStory, Apurva Salapuria, Hitesh Oberoi, Sidharth Pansari, Nirupa Shankar",Seed Funding,"5,50,000",
1808,26/04/2016,Transerv,Consumer Internet,Digital Payments platform,Mumbai,"IDFC SPICE Fund, Micromax Informatics",Private Equity,"1,50,00,000",
1809,26/04/2016,ClearTax,Consumer Internet,Online filing of Tax returns,Bangalore,"Max Levchin, Scott Banister",Private Equity,"13,00,000",
1810,26/04/2016,Roposo,eCommerce,Social Fashion ECommerce Discovery platform,Gurgaon,Bertelsmann India Investments,Private Equity,"1,50,00,000",
1811,27/04/2016,MilkBasket,Consumer Internet,Micro Grocery Delivery Platform,Gurgaon,EVC Ventures,Seed Funding,"5,00,000",
1812,27/04/2016,CareonGO,Consumer Internet,Online Pharmacy,,"Farooq Oomerbhoy, Anupam Mittal, Anand Mittal, Ravi Garikipati, Vibhu Garg, Singapore Angel Network, Konglo Ventures",Seed Funding,,
1813,27/04/2016,RailYatri,Consumer Internet,Train Related Information portal,Noida,"Nandan Nilekani, Helion Ventures, Omidyar Networks, Blume Ventures",Private Equity,,
1814,27/04/2016,ICHR,Consumer Internet,Mobile based Children health Information app,New Delhi,Undisclosed,Seed Funding,"4,50,000",
1815,27/04/2016,Murgency,Consumer Internet,Medical Emergency Response App,Mumbai,Axilor Ventures,Private Equity,,
1816,28/04/2016,The Wedding Brigade,Consumer Internet,Online Wedding Information Portal,Mumbai,Blume Ventures & Other unnamed Investors,Seed Funding,"6,00,000",
1817,28/04/2016,DocsApp,Consumer Internet,Online Doctor Discovery & Chat platform,Bangalore,"Rebright Partners, Anand Rajaraman, Venky Harinarayan",Private Equity,"12,00,000",
1818,29/04/2016,Impact Guru,Consumer Internet,Online Crowdfunding platform for NGOs & Social Projects,Mumbai,"RB Investments, Fundnel",Seed Funding,"5,00,000",
1819,29/04/2016,LetReach,eCommerce,ECommerce SAAS Solutions,New Delhi,vCommission,Private Equity,"1,00,000",
1820,01/03/2016,DriveU,Consumer Internet,Chauffeurs Discovery for private car owners,Bangalore,Unitus Seed Fund,Seed Funding,,
1821,01/03/2016,Gympik,Consumer Internet,"Fitness Centres, Gym Discovery online marketplace",Bangalore,RoundGlass Partners,Private Equity,,
1822,01/03/2016,Testbook,Consumer Internet,Online Test Preparation Platform,Mumbai,S Chand & Co,Private Equity,,
1823,01/03/2016,IQlect,Technology,Big Data Analytics Platform,Bangalore,"Lip-Bu Tan, Michael Marks, Nicolas Braithwaite",Private Equity,,
1824,02/03/2016,MoMark,Consumer Internet,Mobile Wallet Aggregation platform,Noida,YourNest Angel Fund,Private Equity,"6,00,000",
1825,02/03/2016,Skedool,Consumer Internet,AI based Office Assistant Mobile App,Seattle / Bangalore,"Kludein LLC\\nPhanindra Sama, Narayan Ramachandran, Pranav Pai",Seed Funding,,
1826,02/03/2016,Systemantics,Technology,Industrial robots maker,Bangalore,"Nandan Nilekani, Accel Partners",Private Equity,"14,00,000",
1827,03/03/2016,Vertuals,Technology,Audio Visual Digital Content creators for Brands,Mumbai,Dino Morea,Seed Funding,,
1828,03/03/2016,Imarticus Learning,Education,Financial Services & Analytics Education Institute,Mumbai,"Blinc Advisors, Amit Nanavati, Tashwinder Singh, Taranjit Jaswal, Amit Khanna",Private Equity,"10,00,000",
1829,03/03/2016,Shouut,Consumer Internet,Social Discovery Mobile app,New Delhi,Undisclosed investor,Seed Funding,"5,00,000",
1830,04/03/2016,TinyStep,Consumer Internet,Parenting Social Network Platform,Bangalore,Matt Glickman,Private Equity,,
1831,04/03/2016,Aahaa,ECommerce,Office Products Super Store,Chennai,"YourNest Angel Fund,",Private Equity,"10,00,000",
1832,04/03/2016,Arcatron Mobility,Technology,Smart wheelchair Design and Development,Pune,"Sudhir Mehta, Anoop Hingorani",Seed Funding,,
1833,04/03/2016,FTCash,Consumer Internet,Mobile Payments Platform,Kolkata,IvyCap Ventures,Seed Funding,"1,50,000",
1834,04/03/2016,Civilsdaily,Consumer Internet,Civil Services News Aggregator,New Delhi,Manoj Kumar & Other undisclosed investors,Seed Funding,,
1835,04/03/2016,Zappka,Consumer Internet,Mobile App discovery and review platform,Gurgaon,"Daman Soni, Rajat Gupta & Others",Seed Funding,"1,00,000",
1836,04/03/2016,Tarusa World,ECommerce,Handicraft products eTailer,Mumbai,Mohit Gulati,Seed Funding,,
1837,04/03/2016,medECUBE,Healthcare,Healthcare related Services provider,Gurgaon,Artiman Ventures,Private Equity,"40,00,000",
1838,07/03/2016,N.O.W,Consumer Internet,Bike Taxi Service & Hyperlocal Delivery App,Noida,"Ruchirans Jaipuria, Anuj Sanghi",Seed Funding,"5,00,000",
1839,07/03/2016,Ninjacart,ECommerce,B2B marketplace for Farmers & Retailers,Bangalore,"Accel Partners, Qualcomm Ventures, M&S Partners, Zop Smart",Private Equity,"30,00,000",
1840,07/03/2016,Reach,Consumer Internet,Cross Platform P2P file sharing mobile app,Bangalore,"Rebright Partners, Sol Primero, Sudhir Anandarao, Ankur Warikoo, Ankur Singla",Seed Funding,"5,00,000",
1841,07/03/2016,Vanity Cube,Consumer Internet,Hyperlocal Beauty Services platform,New Delhi,Unicorn Ventures,Seed Funding,"2,50,000",
1842,07/03/2016,Wooplr,ECommerce,Curated Fashion ECommerce portal,Bangalore,"Naveen Tewari, Abhay Singhal, Amit Gupta, Piyush Shah, Raghunandan G, Rajiv Mehta",Seed Funding,,
1843,07/03/2016,Medidaili,Consumer Internet,Medical Support service platform,Bangalore,Undisclosed private investors,Seed Funding,"1,00,000",
1844,08/03/2016,Finomena,Technology,Credit Worthiness Big Data Analytics,New Delhi,Matrix Partners India,Private Equity,,
1845,08/03/2016,Cookaroo,Consumer Internet,Food Delivery Platform,Bangalore,Vijay Krishna Yadav,Seed Funding,,
1846,08/03/2016,vPhrase Analytics,Technology,AI based data analytics platform,Mumbai,"Apoorv Ranjan Sharma, Daud Ali and others",Seed Funding,,
1847,08/03/2016,LoveCycles,Consumer Internet,Women\\xe2\\x80\\x99s health Tracker,Bangalore,Prime Venture Partners,Seed Funding,"7,50,000",
1848,08/03/2016,Kartrocket,ECommerce,ECommerce SAAS platform,New Delhi,"Undisclosed Japanese investor, Bertelsmann India Investments, Nirvana Digital India Fund, Nirvana Digital Investment Holding Co Ltd, 500 Start-Ups",Private Equity,"80,00,000",
1849,08/03/2016,dunzo,Consumer Internet,Daily Task Management App,Bangalore,"Aspada Investment Advisors, Blume Ventures.",Seed Funding,"6,50,000",
1850,09/03/2016,Indiamart,ECommerce,B2B Marketplace for SMBs,Noida,Amadeus Capital,Private Equity,,
1851,09/03/2016,SmartVizX,Technology,Virtual Reality Solutions,Noida,"Indian Angel Network, Stanford Angels, Entrepreneurs India",Seed Funding,"5,00,000",
1852,09/03/2016,MyGubbi,Real Estate,Interior Design & Home D\\xc3\\xa9cor Solutions,Bangalore,"Vipul Parekh, ajesh K Murthy,",Seed Funding,"25,00,000",
1853,09/03/2016,Nukkad Shops,Consumer Internet,Hyperlocal Grocery Delivery Service,Hyderabad,PurpleTalk Inc,Seed Funding,"10,00,000",
1854,09/03/2016,Cloudacar,Consumer Internet,Carpooling Mobile App,Pune,"Amit Choudhary, Anuj Puri",Seed Funding,,
1855,09/03/2016,Justride,Consumer Internet,Self Drive Car Rental,Mumbai,Dheeraj Jain & Other angel investors,Seed Funding,"4,00,000",
1856,09/03/2016,Yana,Consumer Internet,Personal AI Transaction Engine App,Gurgaon,"Puneet Gupta,",Seed Funding,,
1857,10/03/2016,Big Fish Ventures,Food & Beverage,premium dining lounges Chain,New Delhi,Undisclosed investors,Private Equity,"1,11,00,000",
1858,10/03/2016,Stylflip,ECommerce,Pre-Owned Fashion marketplace mobile app,Mumbai,"Raj Gala Shah, Zaheer Memon",Seed Funding,,
1859,10/03/2016,Icertis,Technology,Contract Management Software Solutions platform,Pune/Seattle,"Ignition Partners, Greycroft Partners, Fidelity Growth Partners India",Private Equity,"1,50,00,000",
1860,10/03/2016,Supplified,ECommerce,Construction material eTailer,New Delhi,Mohit Goel,Seed Funding,"10,00,000",
1861,11/03/2016,JollyFoodFellow,Technology,Food Related Marketing & Branding platform,Ahmedabad,Janak Parikh,Seed Funding,,
1862,14/03/2016,PinkBlue,ECommerce,Medical Supplies eTailer,Bangalore,"Hari Krishna, Ajay Modani, Dr V Ravinder, Anirudh Rastogi, Abhishek Jain, Rakesh Gakhar, Rajeev Mudumba, Nagendra Prasad Bhanuprakash",Seed Funding,"2,23,608",
1863,14/03/2016,TruckingCube,Logistics,"Domestic, Commercial, and Industrial Goods Movers",New Delhi,Agarwal Movers Group,Private Equity,"1,49,00,000",
1864,14/03/2016,eSwasthya,Consumer Internet,Online Medicine Delivery Aggregator,Ahmedabad,Hemang Sahani,Seed Funding,,
1865,15/03/2016,FlipClass,Consumer Internet,Tutor Search Platform,Bangalore,"S Chand and Co Pvt Ltd, Blume Ventures",Private Equity,"10,00,000",
1866,15/03/2016,Proximit,Technology,Advertising Technology,Pune,Funding through 1Crowd platform,Seed Funding,"1,50,000",
1867,15/03/2016,WithMe,Consumer Internet,Personalized Fashion App,Gurgaon,"Alex Kuruvilla, Pradeep Guha, Saket Dhankar, Rajan Pandhare",Seed Funding,"2,50,000",
1868,16/03/2016,Gapoon,Consumer Internet,Hyperlocal Home Maintenance services,Bangalore,"Chandrashekar Tallapragada, Pankaj Kapoor",Seed Funding,"1,80,000",
1869,16/03/2016,Avagmah,Consumer Internet,Online Education Portal,Bangalore,"Kris Gopalakrishnan, Atul Nishar",Seed Funding,,
1870,16/03/2016,WorkIndia,Consumer Internet,Online Job Board,Mumbai,Beenext,Seed Funding,,
1871,16/03/2016,Wealthy,Consumer Internet,Online Investment management portal,Bangalore,"Zishaan Hayath, Abhishek Goyal, Arjun and Rohan Malhotra, Harpreet Singh Grover, Gagan Dugal",Seed Funding,"2,50,000",
1872,17/03/2016,Pramati,Healthcare,Specialized Patient Care platform,Noida,Undisclosed investors,Seed Funding,"2,00,000",
1873,17/03/2016,Qlivery,Consumer Internet,Ondemand Concierge Service,Gurgaon,Swastika Company Ltd,Seed Funding,"2,30,000",
1874,17/03/2016,HealthEnablr,Consumer Internet,Doctor Discovery and booking platform,Mumbai,Undisclosed investors,Seed Funding,"8,00,000",
1875,17/03/2016,Liftiee,Consumer Internet,Car/ bike Pooling App,Mumbai,"Rannvijay Singh, Anita Hassanandani",Seed Funding,"1,08,000",
1876,18/03/2016,Hello Curry,Food & Beverage,Quick Service Restaurant Chain,Hyderabad,Sashi Reddi & Other unnamed investors,Private Equity,"15,00,000",
1877,19/03/2016,goSporto,Consumer Internet,Online Sports discovery and booking platform,New Delhi,Naveen Gupta,Seed Funding,"30,000",
1878,21/03/2016,OneClickWash,Consumer Internet,Online Laundry & Washing service Booking & Delivery,Gurgaon,Unitus Seed Fund,Seed Funding,,
1879,21/03/2016,Girnar Software,Consumer Internet,Online News Media Network,Jaipur,Google Capital,Private Equity,,
1880,21/03/2016,Room On Call,Consumer Internet,Budget hotel aggregator,Gurgaon,CASHurDRIVE Marketing Pvt Ltd,Private Equity,"20,00,000",
1881,22/03/2016,Byju\\xe2\\x80\\x99s,Consumer Internet,Educational Video Content Creator,Bangalore,"Sequoia India, Sofina",Private Equity,"7,50,00,000",
1882,22/03/2016,BigBasket,eCommerce,Online Grocery Shop,Bangalore,Abraaj Group,Private Equity,"15,00,00,000",
1883,22/03/2016,DrivoJoy,Consumer Internet,On-demand 2-wheeler Servicing platform,Bangalore,"Indian Angel Network, Tracxn Labs & Others",Seed Funding,"6,00,000",
1884,22/03/2016,Smartron,Technology,Internet of Things Device manufacturer,Bangalore,Sachin Tendulkar,Private Equity,,
1885,22/03/2016,LifCare,Consumer Internet,Online Pharmacy portal,Jaipur,"Rajul Garg, Alok Mittal, Kunal Shah, Rishi Mandawat, Dheeraj Jain, Sandeep Tandon, Dexter Angel Circle",Seed Funding,,
1886,22/03/2016,CreditSeva,Consumer Internet,Online Credit management tools,Hyderabad,"Pix Vine Capital, Infocomm Development Authority of Singapore",Seed Funding,"3,60,000",
1887,22/03/2016,CityShor,Consumer Internet,online lifestyle media recommendation portal,Ahmedabad,GAIN,Seed Funding,,
1888,23/03/2016,Endless Robotics,Technology,Interior Painting Automation,Hyderabad,"Devidas Desai, Vipul Gautam, Singapore Angel Network",Seed Funding,"1,00,000",
1889,23/03/2016,SP Robotics,Technology,Robotic Classes for Students,Chennai,"Indian Angel Network,",Seed Funding,"3,00,000",
1890,23/03/2016,StalkBuyLove,eCommerce,Fashion eTailer,New Delhi,"500 Startups, Littlerock, Singularity Ventures",Seed Funding,,
1891,23/03/2016,eKincare,Consumer Internet,Healthcare related solutions,Hyderabad,"BitChemy Ventures, Maheshwari Investments Pvt Ltd, Anshoo Gaur, Rama Krishna Reddy, Sandeep Seerapu",Private Equity,"3,30,000",
1892,23/03/2016,HashLearn,Consumer Internet,Mobile based private tutoring services,,"Bhavish Aggarwal, Binny Bansal,\\xc2\\xa0 Rajan Anandan, Mekin Maheshwar, Sunil Kalra, Anupam Mittal, Krishna Mehra, Singapore Angel Network",Seed Funding,,
1893,23/03/2016,Wheelstreet,Consumer Internet,Online Bike Rental platform,Bangalore,Broadbean Capital services,Private Equity,"5,00,000",
1894,24/03/2016,Horntell,Consumer Internet,Unified Push Notification service,Gurgaon,"Bharanidharan Viswanathan, Sanjiv Mittal, Shobhit Shukla, Rahul Agarwal",Seed Funding,"1,50,000",
1895,28/03/2016,Schoolkart,eCommerce,Online Marketplace for Schools,Noida,Undisclosed investors,Seed Funding,"3,00,000",
1896,29/03/2016,HealthEminds,Consumer Internet,Online mental healthcare,Bangalore,Robin Utthappa,Seed Funding,,
1897,29/03/2016,Babygogo,Consumer Internet,Child healthcare experts aggregator mobile app,New Delhi,"Rajul Garg, Daljit Singh, Aditya Vij, Kishore Kumar, Shuchin Bajaj",Seed Funding,"3,00,000",
1898,29/03/2016,Veritas Finance,Finance,Asset Based Lending platform,Chennai,Sarva Capital,Private Equity,"47,00,000",
1899,29/03/2016,QikShip,Consumer Internet,Mobile based Logistics provider,New Delhi,undisclosed investors,Seed Funding,"2,00,000",
1900,29/03/2016,FixNix,Consumer Internet,GRC SAAS Platform,Chennai,Jay Vijayan,Seed Funding,"5,00,000",
1901,30/03/2016,True Balance,Technology,Mobile Balance Check App,Gurgaon,SoftBank Ventures Korea,Private Equity,,
1902,30/03/2016,Touchkin,Healthcare,Predictive Healthcare platform,Bangalore,"Alok Mittal, Amit Gupta, Anuj Srivastava, Himanshu Aggarwal, Raghunandan G, Puneet Agarwal",Seed Funding,"4,00,000",
1903,31/03/2016,SwitchMe,Consumer Internet,Home Loan Rate comparison platform,Mumbai,"Mohandas Pai, Hiro Mashita, Singapore Angel Network, 500 Startups, Rajan Anandan, Ajay Sarupria",Seed Funding,,
1904,31/03/2016,Transcell,Healthcare,Family Stem Cell Banking Services,Hyderabad,Indian Angel Network,Seed Funding,,
1905,01/02/2016,Blue Tokai Coffee,ECommerce,Specialty Coffee Etailer,New Delhi,Snow Leopard Technology Ventures,Seed Funding,,
1906,02/02/2016,Altizone,Technology,IoT & M2M Solutions,Pune,"Wipro Ventures,\\xc2\\xa0 Lumis Partners",Private Equity,"40,00,000",
1907,02/02/2016,Oust App,Consumer Internet,Competitive Exam Preparation Platform,Bangalore,"T V Mohandas Pai,\\xc2\\xa0 Aarin Capital",Seed Funding,,
1908,02/02/2016,Strike,Consumer Internet,Mobile Email productivity tool,Bangalore,Multiple investors through Ten Minute Million competition,Seed Funding,"22,500",
1909,02/02/2016,MaaxMarket,Consumer Internet,Marketing Automation platform,,Multiple investors through Ten Minute Million competition,Seed Funding,"22,500",
1910,02/02/2016,Gamooz,Technology,Augmented Reality Solutions,Gurgaon,Multiple investors through Ten Minute Million competition,Seed Funding,"22,500",
