Sr No,Date dd/mm/yyyy,Startup Name,Industry Vertical,SubVertical,City  Location,Investors Name,InvestmentnType,Amount in USD,Remarks
1537,13/07/2016,CityFurnish,Consumer Internet,Online Furniture Renting Platform,Gurgaon,Brand Capital,Seed Funding,,
1538,13/07/2016,HEAL Institute,Healthcare,Sports Focused Healthcare Startup,Mumbai,"Jaspal Bindra, Parth Jindal",Seed Funding,,
1539,14/07/2016,Augrav,eCommerce,Personalized precious Jewellery etailer,Coimbatore,Keiretsu Forum,Seed Funding,"4,50,000",
1540,14/07/2016,ShoppinPal,Technology,M-Commerce Solutions for Retail Stores,Pune,"Plug and Play Tech Center, Steelhead Ventures & Others",Private Equity,"10,70,000",
1541,14/07/2016,TransTutors / AskIITians,Consumer Internet,Online Education & Tutoring portals,New Delhi,500 Startups,Private Equity,,
1542,15/07/2016,WorkApps,Technology,Enterprise Work Management Software,Pune,SRI Capital,Seed Funding,"10,00,000",
1543,15/07/2016,BankerBay,Consumer Internet,Online Investment Banking platform,Bangalore,undisclosed investors,Private Equity,"20,00,000",
1544,15/07/2016,BaggOut,eCommerce,Women\\xe2\\x80\\x99s Fashion etailer,New Delhi,"Sumit Jain, Sumit Jain, Anurag Gupta, Varun Khanna, Faraz Khan",Seed Funding,,
1545,15/07/2016,TripShelf,eCommerce,Travel Package Marketplace,New Delhi,GEMS group,Seed Funding,"2,50,000",
1546,15/07/2016,SatvaCart,eCommerce,Online Grocers,New Delhi,"Abhijit Avasthi, Karan Chellani, SP Vijay",Seed Funding,,
1547,15/07/2016,Ridlr,Consumer Internet,Public Transport Mobile App,Mumbai,"Times Internet, Innoven Capital, Matrix Partners India, Qualcomm Ventures",Private Equity,"60,00,000",
1548,18/07/2016,Yellowdig,Consumer Internet,Online Learning Platform,Pune,SRI Capital,Seed Funding,"6,50,000",
1549,18/07/2016,Zuppler,Consumer Internet,Online Food Ordering platform,New Delhi,SRI Capital,Seed Funding,"6,50,000",
1550,18/07/2016,BlueStone,eCommerce,Jewellery Etailer,Mumbai,"IIFL and Accel Partners, Kalaari Capital, IvyCap Ventures, RB Investments",Private Equity,"3,00,00,000",
1551,18/07/2016,underDOGS,Technology,Game Development Startup,Mumbai,Intelli Reboot Digital Pvt. Ltd,Private Equity,,
1552,18/07/2016,ImageProVision,Technology,Image Analysis Solutions,Pune,Satish Jamdar,Seed Funding,,
1553,19/07/2016,Sagacito,Technology,Cloud-Based Enterprise Solutions,New Delhi,Star India Pvt. Ltd,Private Equity,"1,00,00,000",
1554,19/07/2016,Deal4Loans / Wishfin,Consumer Internet,\\nLoans Comparison platform\\n\\n\\n\\n     (adsbygoogle = window.adsbygoogle || []).push({});\\n\\n,Noida,Franklin Templeton International Services Pvt. Ltd,Private Equity,"1,50,00,000",
1555,19/07/2016,NiYO Solutions,Technology,Payroll & Benefits Software solutions,Bangalore,Prime Venture Partners,Private Equity,"10,00,000",
1556,19/07/2016,AppLop,Consumer Internet,Mobile Apps SaaS Platform,Gurgaon,Green House Ventures Accelerator,Seed Funding,"2,50,000",
1557,20/07/2016,Tax2Win,Consumer Internet,Online Tax Filing Portal,Jaipur,Undisclosed Investors,Private Equity,"10,00,000",
1558,20/07/2016,Truckola,Logistics,Tech-focused cargo transport startup,Mumbai,"Abhishek Agarwal, Krishnakumar Nataraj, Sarath Sura, Shanti Mohan, Sarthak and Nihit Agarwal, Suramya Gupta",Seed Funding,"5,95,000",
1559,20/07/2016,iServe Financial,Consumer Internet,Loan Comparison & Deals platform,Pune,Nilesh Shah,Seed Funding,,
1560,21/07/2016,MyTaxiIndia,Consumer Internet,Online Car rental booking platform,New Delhi,Nihon Kotsu Co,Private Equity,"10,00,000",
1561,21/07/2016,AbeRuk,eCommerce,Online Marketplace for books,Bangalore,Swastika Company Pvt Ltd,Seed Funding,,
1562,21/07/2016,Wiwigo,Consumer Internet,Inter-City Taxi Booking platform,Bangalore,Indian Angel Network,Seed Funding,"5,95,000",
1563,21/07/2016,Drums Food,Food & Beverage,Yogurt and Ice Cream maker,Mumbai,"Verlinvest, DSG Consumer Partners",,,
1564,01/06/2016,Chikoop,Consumer Internet,Free Ad based Voice Calling,Indore,Undisclosed Investors,Seed Funding,,
1565,01/06/2016,BRIDGEi2I,Technology,Data Analytics Platform,Bangalore,Edelweiss Private Equity,Private Equity,,
1566,02/06/2016,Droom,eCommerce,Online marketplace for used automobiles,New Delhi,"Beenext, Digital Garage, Lightbox, Beenos",Private Equity,,
1567,02/06/2016,Visit,Consumer Internet,On-Demand Healthcare Service provider,New Delhi,MapmyIndia,Seed Funding,,
1568,02/06/2016,Atomberg,Technology,"smart, energy efficient home appliance manufacturer",Mumbai,Parampara Capital,Private Equity,"10,00,000",
1569,02/06/2016,Coutloot,eCommerce,Fashion Re-Commerce Platform,Mumbai,Venture Catalysts,Seed Funding,,
1570,02/06/2016,Limo,Consumer Internet,Bus Aggregator Mobile app,Mumbai,Rainmaker Ventures,Private Equity,"10,00,000",
1571,03/06/2016,iCliniq,Consumer Internet,Doctor Consultation platform,Bangalore,MadhanKumar Madathupalayam,Seed Funding,,
1572,03/06/2016,GoGo Truck,Consumer Internet,Truck Aggregator & Booking platform,Chennai,Undisclosed Investor,Seed Funding,"75,000",
1573,03/06/2016,Vyome Biosciences,Healthcare,Treatment Development for Antibiotic-resistant diseases,New Delhi,Romulus Capital,Private Equity,"20,00,000",
1574,06/06/2016,SillyMonks,Consumer Internet,Digital Media and Entertainment Startup,Hyderabad,Sreenivasa Reddy Musani,Seed Funding,"4,48,000",
1575,07/06/2016,CueMath,Education,K-12 Maths Learning Courses,Bangalore,"Sequoia Capital, Unitus Seed Fund",Private Equity,"40,00,000",
1576,07/06/2016,KrazyBee,Consumer Internet,Student Micro-Loan platform,Bangalore,"Yeahmobi, Fenqile",Private Equity,"20,00,000",
1577,07/06/2016,Intgrea,Technology,Post merger Integration Partners,Bangalore,Undisclosed Investor,Seed Funding,"1,00,000",
1578,07/06/2016,HelpShift,Technology,Mobile CRM Platform,Pune,"Microsoft Ventures, Salesforce Ventures",Private Equity,"2,30,00,000",
1579,07/06/2016,CreditVidya,Technology,Credit Scoring Platform,Mumbai,Kalaari Capital,Private Equity,"10,00,000",
1580,08/06/2016,Grey Campus,Consumer Internet,Online Learning Platform,Hyderabad,Sarath Sura,Seed Funding,"10,00,000",
1581,08/06/2016,ListUp,eCommerce,Location based Classified Mobile app,Mumbai,"Kae Capital, Kunal Shah, Sandeep Tandon",Seed Funding,"5,00,000",
1582,08/06/2016,6Degree,Technology,Tech-enabled Fashion Talent platform,Mumbai,Indian Angel Network,Seed Funding,"2,00,000",
1583,08/06/2016,Shopwati,Consumer Internet,Online Fashion Discussion Community,Gurgaon,Sanjiv Rai,Seed Funding,,
1584,08/06/2016,Cookifi,Consumer Internet,Online Chef Discovery & Booking Service,Bangalore,"Kunal Shah, Aneesh Reddy, Tracxn Labs, Venkat Tadanki, Krishna Mehra, Amit Rathore",Seed Funding,,
1585,08/06/2016,StoreKing,eCommerce,Connecting Small Town Consumers to E-Commerce,Bangalore,Axiata Digital,Private Equity,"1,60,00,000",
1586,08/06/2016,Wired Hub,Real Estate,Co-Working Spaces,Jaipur,"Ankit Maheshwari, Anand Singh",Seed Funding,,
1587,08/06/2016,MySeniorDoctor,Consumer Internet,Online medical support platform,Gurgaon,BlackJag Partners,Seed Funding,"2,00,000",
1588,09/06/2016,Teabox,eCommerce,Online Tea Store,Siliguri,Cameron Jones,Seed Funding,,
1589,09/06/2016,ExtraaEdge,Consumer Internet,Student Acquisition Platform,Pune,"Ritesh Dwivedy, Priti Padhy",Seed Funding,,
1590,09/06/2016,EPayLater,Technology,Fin-Tech Platform,Mumbai,3 undisclosed HNIs,Seed Funding,"20,00,000",
1591,10/06/2016,Kyazoonga,eCommerce,Online event ticketing Platform,Mumbai,Ratan Tata,Seed Funding,,
1592,10/06/2016,Paytunes,Consumer Internet,Mobile based rewards platform,New Delhi,"CIO Angel Network, Indian Angel Network",Private Equity,"5,00,000",
1593,10/06/2016,Kickstart Jobs,Technology,Entry level hiring platform,Gurgaon,"Vivek Joshi, Mohit Satyanand, Amit Banati, Arun Khanna",Seed Funding,,
1594,10/06/2016,Freshee,FMCG,Household packaging & Storage product manufacturer,Mumbai,Edelweiss Private Equity,Private Equity,,
1595,10/06/2016,MadRat Games,Technology,Wearable Gaming Platform,Bangalore,"Ratan Tata, Bhavish Aggarwal, Ankit Bhati, Binny Bansal, Girish Mathrubootham",Seed Funding,,
1596,11/06/2016,Jazzmyride,eCommerce,Auto Parts & Accessories eTailer,New Delhi,TVS Automobile Solutions Ltd,Private Equity,,
1597,11/06/2016,AutoSense,Technology,Data Analytics based Customer Management Services,New Delhi,TVS Automobile Solutions Ltd,Private Equity,,
1598,11/06/2016,Redsun Telematics,Consumer Internet,Internet of Things Platform,Chennai,TVS Automobile Solutions Ltd,Private Equity,,
1599,13/06/2016,KhanaGadi,Consumer Internet,Online Food Delivery for Train Travelers,Jaipur,50K Ventures,Seed Funding,,
1600,13/06/2016,Bombay Shirt Company,eCommerce,Online custom Shirt retailer,Mumbai,undisclosed investor,Private Equity,"10,00,000",
1601,13/06/2016,Matrubharti,Consumer Internet,e-Book Publisher,,Viridian Capital,Seed Funding,"30,000",
1602,14/06/2016,EdTechReview,Consumer Internet,Education based online portal,New Delhi,EVC Ventures,Seed Funding,,
1603,14/06/2016,Bonhomia,Food & Beverage,Premium Tea & Coffee Capsules maker,New Delhi,Valpro Capital and existing investors,Private Equity,,
1604,14/06/2016,Gobolt,Logistics,B2B Logistics provider,New Delhi,MCube8,Seed Funding,,
1605,14/06/2016,Jivox,Technology,Data Driven Advertising platform,Bangalore,"You & Mr Jones, Fortisure Ventures, Diaz Nesamoney",Private Equity,"60,00,000",
1606,14/06/2016,Sminq,Consumer Internet,Queue management Mobile app,Pune,"Saama Capital, Blume Ventures & Vaibhav Domkundwar",Seed Funding,"10,00,000",
1607,14/06/2016,CureJoy,Consumer Internet,Online Alternative health community platform,Bangalore,Accel Partners India,Private Equity,"44,00,000",
1608,15/06/2016,Oneway.cab,Consumer Internet,Taxi Rental Platform,Vadodara,Indian Angel Network,Seed Funding,"4,50,000",
1609,15/06/2016,GrabOnRent,eCommerce,On-demand product rental marketplace,Bangalore,IvyCap Ventures and Unicorn India Ventures,Private Equity,,
1610,16/06/2016,Diro Labs,Consumer Internet,Contact Management Mobile App,New Delhi,Info Edge (India) Ltd,Private Equity,"4,50,000",
1611,16/06/2016,Unnati Helpers,Consumer Internet,Help Hiring Platform,Gurgaon,Info Edge (India) Ltd,Private Equity,"6,00,000",
1612,16/06/2016,Athletto,Consumer Internet,Sports Venue discovery and booking platform,Bangalore,Atul Ingle,Seed Funding,,
1613,16/06/2016,Saavn,Consumer Internet,Web/Mobile Music Streaming service,USA,Guy Oseary,Private Equity,,
1614,16/06/2016,Voonik,eCommerce,Online Women\\xe2\\x80\\x99s Fashion Marketplace,Bangalore,Sequoia Capital,Private Equity,"2,00,00,000",
1615,16/06/2016,ThinkPhi,Technology,Sustainable Green Tech Solution developer,Mumbai,Nimmagadda Prasad,Seed Funding,,
1616,17/06/2016,Cleartax,Consumer Internet,Online Tax Filing Platform,New Delhi,"Ravi Adusumalli, SAIF Partners",Private Equity,"1,20,00,000",
1617,17/06/2016,Silvan Innovation Labs,Technology,Home Automation Solutions,Bangalore,Infuse Ventures,Private Equity,"9,00,000",
1618,17/06/2016,GreytHR,Technology,Payroll & HR Software Developer,Bangalore,"New Enterprise Associates (NEA), Blume Ventures",Private Equity,"52,00,000",
1619,17/06/2016,Duffl,eCommerce,Fashion Rental Marketplace,Bangalore,BetOnIndia Technology Pvt Ltd,Seed Funding,,
1620,17/06/2016,BYG,Consumer Internet,Fitness centre Discovery & Booking Mobile app,Bangalore,"Sanjay Verma, Amit Khanna (LetsVenture)",Seed Funding,,
1621,20/06/2016,Dipper,eCommerce,Freight Logistics Marketplace,New Delhi,Undisclosed investor,Seed Funding,,
1622,20/06/2016,Qonfuse,Consumer Internet,Online Test Papers for competitive exams,New Delhi,Hamraj Kumar,Seed Funding,,
1623,20/06/2016,The Indian IRIS,Consumer Internet,Govt Policy Research & Information portal,Ahmedabad,Timbru Ventures,Seed Funding,,
1624,21/06/2016,Onspoon,Consumer Internet,Online Platform for Event Sponsorship,Mumbai,Swan Angel Network,Seed Funding,"1,50,000",
1625,21/06/2016,REstate,Consumer Internet,Real Estate Platform,Bangalore,Idein Ventures,Seed Funding,,
1626,21/06/2016,Cleartrip,Consumer Internet,Online Travel Agency,Mumbai,"Concur Technologies, Gund Investment",Private Equity,,
1627,21/06/2016,ProcMart,Consumer Internet,Online Procurement Marketplace,Noida,IndiaMart,Private Equity,,
1628,21/06/2016,Celerix,Technology,Fintech Product Development & Services Startup,Bangalore,Bitkemy Ventures,Seed Funding,"4,00,000",
1629,21/06/2016,NatureNama,Consumer Internet,Online Outdoors & travel,Mumbai,Unicorn Venture,Seed Funding,"2,25,000",
1630,21/06/2016,CyclopsMedtech,Technology,Medical Technology Provider,Bangalore,CP Bothra,Seed Funding,,
1631,21/06/2016,Syona Cosmetics,FMCG,Beauty Products & Training to Salons & Spas,Chennai,The Chennai Angels,Seed Funding,"1,50,000",
1632,21/06/2016,PrettySecrets,eCommerce,Women Lingerie Store,Mumbai,"RB Investments PTE Ltd, Orios Venture Partners",Private Equity,"60,00,000",
1633,22/06/2016,SpiderG,Consumer Internet,Online invoice app for SMEs,Pune,"Rahul Kirloskar, Fusion Tech Ventures, Adi Saravanan, Pravin Dongre, Mahendra Doshi",Seed Funding,"1,50,000",
1634,23/06/2016,FarEye,Technology,Logistics Management Software,New Delhi,Saif Partners,Private Equity,"35,00,000",
1635,23/06/2016,The Uolo,Consumer Internet,School Parent Communication App,Bangalore,"Purvi Ventures, Rajul Garg, Vipin Arora",Seed Funding,"2,10,000",
1636,23/06/2016,Staqu,Technology,Artificial Intelligence based search platform,Gurgaon,Indian Angel Network,Seed Funding,,
1637,23/06/2016,Padhopadhao,Consumer Internet,Home Tutors search & Discovery,New Delhi,Rise India,Private Equity,,
1638,24/06/2016,Drivify,Consumer Internet,Professional Driver discovery & Booking Mobile app,Mumbai,"Jitendra Gupta, Pankaj Tripathi",Seed Funding,"50,000",
1639,24/06/2016,PratiLipi,Consumer Internet,Multi-Lingual self-publishing platform,Bangalore,Nexus Venture Partners,Seed Funding,,
1640,24/06/2016,ParaBlu,Technology,Cloud Data Security & Privacy Solutions,Bangalore,Kalaari Capital,Seed Funding,"5,00,000",
1641,24/06/2016,Schedulers Logistics,Logistics,Cold Storage Logistics solutions,Mumbai,GVFL,Private Equity,"60,00,000",
1642,24/06/2016,LEAP India,Others,Supply Chain Equipment & Services provider,Mumbai,Mayfield Ventures,Private Equity,"30,00,000",
1643,24/06/2016,KabadiExpress,Others,Free Door Step Scrap Pickup Service,New Delhi,Undisclosed investor,Seed Funding,"1,48,000",
1644,27/06/2016,YourDost,Consumer Internet,Online counselling & Personal coaching platform,Bangalore,"SAIF Partners, Aprameya Radhakrishnan, Phanindra Sama, Subba Rao Telidevara, Vibhu Garg, Paula Ravindra Mariwala, Gaurav Bhalotia",Seed Funding,"12,00,000",
1645,27/06/2016,Gomalon,Consumer Internet,Online Spa & Salon discovery & Booking platform,Bangalore,Undisclosed investor,Seed Funding,"1,00,000",
1646,27/06/2016,Voler Cars,Consumer Internet,Self-Driven Car rental platform,New Delhi,"Kanodia family, Amit Banka",Seed Funding,,
1647,27/06/2016,Travelyaari,Consumer Internet,Online ticket booking platform,Bangalore,GVFL Ltd,Private Equity,"30,00,000",
1648,28/06/2016,FabHotels,Consumer Internet,Online Hotel aggregator & Booking platform,Gurgaon,"Accel Partners, RB Investments",Private Equity,"80,00,000",
1649,28/06/2016,Locanix,Technology,GPS based SaaS Solutions,Ahmedabad,Undisclosed investors,Seed Funding,"3,00,000",
1650,28/06/2016,LendingKart,Consumer Internet,Online Working Capital Business Loans Platform,Ahmedabad,"Bertelsmann India Investments, Mayfield India, Saama Capital, India Quotient",Private Equity,"3,20,00,000",
1651,28/06/2016,Hello Tax,Consumer Internet,Online Tax Filing Platform,New Delhi,Sanjeev Sinha,Seed Funding,"2,95,000",
1652,28/06/2016,MySuperBrain,Consumer Internet,Online Talent Discovery Platform for Kids,Hyderabad,Soniks Consulting,Seed Funding,,
1653,28/06/2016,BlogBeats,Consumer Internet,Online Blogging Platform,Bangalore,Undisclosed Investor,Seed Funding,,
1654,29/06/2016,LetReach,eCommerce,ECommerce SAAS Solutions,New Delhi,vCommission,Private Equity,"1,00,000",
1655,29/06/2016,TrendieApp,Technology,Visual Content Marketing,Kolkata,Harsh Vardhan Hada,Seed Funding,"50,000",
1656,29/06/2016,ImpactGuru,Consumer Internet,Crowdfunding Platform,Mumbai,Piyush Jain,Seed Funding,,
1657,29/06/2016,Velvetcase,eCommerce,Online designer jewellery marketplace,Mumbai,"Uniqorn Ventures Fund, TV Mohandas Pai, S Somasegar",Private Equity,"15,00,000",
1658,30/06/2016,Meru Cabs,Consumer Internet,Online/ Mobile Tax Cab booking,Mumbai,Brand Capital,Private Equity,"2,50,00,000",
1659,30/06/2016,Campus Diaries,Consumer Internet,Student focussed Content Discovery portal,Bangalore,Aarin Capital,Seed Funding,"2,20,000",
1660,30/06/2016,Scripbox,Consumer Internet,Online Mutual Fund Investment platform,Bangalore,"Omidyar Network, Accel Partners & existing investors",Private Equity,,
1661,30/06/2016,Biryani Blues,Food & Beverage,QSR Chain,Gurgaon,Carpediem Capital & Others,Private Equity,"3,68,000",
1662,01/05/2016,MotoMojo,Consumer Internet,Mobile based Vehicle maintenance App,Mumbai,"Niloufer Dundh, Fauzan Rahim, Balamurugan Mani,",Seed Funding,,
1663,01/05/2016,Get My Parking,Technology,Parking Technology Platform,New Delhi,The Chennai Angels,Seed Funding,"3,76,000",
1664,01/05/2016,Prescribez,Consumer Internet,Health Service Aggregator Platform,Pune,Ankush Mehta,Seed Funding,"1,45,000",
1665,02/05/2016,Airwood,Technology,Agri Data & Analytics Platform,Chennai,StartupXseed Ventures,Seed Funding,,
1666,03/05/2016,Mobikwik,Consumer Internet,Mobile & Digital Wallet,Gurgaon,"GMO Payment Gateway, MediaTek",Private Equity,"5,00,00,000",
1667,03/05/2016,iDreamCareer,Consumer Internet,Career Planning Services Portal,New Delhi,Brand Capital,Private Equity,,
1668,03/05/2016,Zwayam,Consumer Internet,Online Recruitment Platform,Bangalore,Undisclosed investors,Seed Funding,"2,50,000",
1669,03/05/2016,BoiBanit,Consumer Internet,Online Food Delivery platform,Vadodara,Undisclosed investors,Seed Funding,,
1670,03/05/2016,Zuver,Consumer Internet,Car driver Discovery App,Mumbai,"Shruth & Smith Group, Hermes Group",Seed Funding,"1,80,000",
1671,03/05/2016,Prepathon,Education,Competitive Exam learning platform,Mumbai,Blume Ventures,Private Equity,,
1672,04/05/2016,EasyRoads,Consumer Internet,Road Trip planning Mobile app,Mumbai,"Rohan Angrish, Hrishi Oberoi, Rahul Mehta, Kapil Hetamsaria, Pranav Dedhia",Seed Funding,"2,00,000",
1673,04/05/2016,Lenskart,eCommerce,Eyewear & Accessories etailer,New Delhi,"International Finance Corp, TPG Growth, Adveq Management, IDG Ventures, Ratan Tata, Kris Gopalakrishnan",Private Equity,"6,00,00,000",
1674,04/05/2016,Seclore,Technology,Enterprise Security Technology platform,Mumbai,"Sistema Asia Fund, Helion Venture, VentureEast, India Alternatives",Private Equity,"1,20,00,000",
1675,04/05/2016,SolarTown,Technology,Solar Rooftop system installation company,Chennai,Grex.in,Seed Funding,"2,00,000",
1676,04/05/2016,Comarete,Technology,Telecom & Media IT services company,Pune,Grex.in,Seed Funding,"2,00,000",
1677,04/05/2016,MyDentistChoice,eCommerce,Medical Supplies eTailer,Hyderabad,Undisclosed investors,Seed Funding,"1,50,000",
1678,04/05/2016,Active.ai,Technology,Intelligent Tech platform for Finance vertical,Singapore,Kalaari Capital Accelerator Program,Seed Funding,"5,00,000",
1679,04/05/2016,Affordplan,Technology,Affordable non-emergency medical service health plans,New Delhi,Kalaari Capital Accelerator Program,Seed Funding,"5,00,000",
1680,04/05/2016,Indee,Consumer Internet,Web Video Streaming Platform,Bangalore,Kalaari Capital Accelerator Program,Seed Funding,"5,00,000",
1681,05/05/2016,Unbxd,Technology,eCommerce product discovery software,New Delhi,"IDG Ventures, Inventus Capital, Indian Angel Network",Private Equity,,
1682,05/05/2016,WebAlligator,Consumer Internet,Cloud Based Software Solutions,Bangalore,Group of undisclosed Angel Investors & HNIs,Seed Funding,"3,75,000",
1683,06/05/2016,EduAce Services,Education,Education Workshops & mentoring programs,Lucknow,MoMagic Technologies,Private Equity,"10,00,000",
1684,06/05/2016,Meesho,eCommerce,Social commerce platform,Bangalore,Rajul Garg & Others,Seed Funding,,
1685,07/05/2016,Zebroads,Logistics,Logistics and Warehousing services,Hyderabad,Undisclosed investors,Seed Funding,"75,000",
1686,09/05/2016,Locus,Technology,Logistics Intelligence platform,Bangalore,"Exfinity Venture Partners, Blume Ventures, BeeNext, Rajesh Ranavat",Private Equity,"27,50,000",
1687,09/05/2016,Toko Innovations,Consumer Internet,Children\\xe2\\x80\\x99s Entertainment Portal,Bangalore,"Roopak Saluja, Vishal Khare",Seed Funding,"4,50,000",
1688,09/05/2016,Rentickle,eCommerce,"Furniture, appliances Portal",New Delhi,"Manish Kheterpal, Vinay Mittal, Dinesh Mittal, Sandeep Gupta",Seed Funding,"2,50,000",
1689,10/05/2016,HealthifyMe,Consumer Internet,Health & Fitness App,Bangalore,"IDG Ventures India, Inventus Capital, Blume Ventures",Private Equity,"60,00,000",
1690,10/05/2016,Zarget,Consumer Internet,Conversion Rate Optimization Platform,Chennai,"Accel Partners, Matrix Partners, Girish Mathrubootham",Private Equity,"15,00,000",
1691,10/05/2016,InnoNano Research,Technology,Clean Water Technology,Chennai,NanoHoldings,Private Equity,"1,80,00,000",
1692,10/05/2016,SchoolWear,eCommerce,School Uniform & Supplies Marketplace,Mumbai,Undisclosed investors,Seed Funding,"15,00,000",
1693,10/05/2016,Swiggy,Consumer Internet,Food Delivery Platform,Bangalore,"Norwest Venture Partners, DST Global, Accel Partners",Private Equity,"70,00,000",
1694,11/05/2016,Zenify,Consumer Internet,Home rental Discovery & Booking Portal,Bangalore,Undisclosed Investors,Private Equity,"9,00,000",
1695,11/05/2016,Faircent,Consumer Internet,Online Peer to Peer Lending platform,Gurgaon,"JM Financial Products Ltd, Arun Tadanki, Doreswamy Nandkishore, Kshitij Jain",Private Equity,,
1696,11/05/2016,Fractal Analytics,Technology,Data Analytics Company,Mumbai,Khazanah Nasional Berhad,Private Equity,"10,00,00,000",
1697,12/05/2016,Unacademy,Consumer Internet,Free Online Education Platform,Bangalore,"Blume Ventures, Rajan Anandan, Sumit Jain, Aprameya Radhakrishna, Sujeet Kumar, Phanindra Sama",Seed Funding,"5,00,000",
1698,12/05/2016,Capital Float,Consumer Internet,Online Lending Platform,Bangalore,"Creation Investments Capital Management, SAIF Partners, Sequoia Capital, Aspada Ventures",Private Equity,"2,50,00,000",
1699,12/05/2016,Life Circle,Healthcare,Senior Healthcare Services,Hyderabad,GROUPE SOS,Private Equity,"1,50,000",
1700,12/05/2016,Dream Wallets,Consumer Internet,Online Crowdfunding platform,Jaipur,"Rakesh Gupta, Aditya Aggarwal, Siddharth Banerjee, Vikas Ranjan, Anshul Jindal, Sunil Koul, and Sanjeev Agrawal",Seed Funding,,
1701,12/05/2016,ShabdNagari,Consumer Internet,Hindi social networking portal,Kanpur,ah! Ventures,Seed Funding,,
1702,12/05/2016,Galleri5,Consumer Internet,Visual Content Discovery platform,Bangalore,"Phanindra Sama, Raghunandan G,",Seed Funding,,
1703,12/05/2016,Derbii,Logistics,Carpooling Services,Gurgaon,Anurag Chauhan,Seed Funding,,
1704,13/05/2016,StayZilla,Consumer Internet,Budget Room Aggregator Booking platform,Chennai,"Matrix Partners, Nexus Ventures",Private Equity,"1,35,00,000",
1705,13/05/2016,WoW Express,Logistics,E-Commerce Logistics Solutions,Mumbai,Undisclosed Investors & Tamarind Family Private Trust,Private Equity,"22,00,000",
1706,16/05/2016,Smartivity,eCommerce,Smart Learning products,Delhi,"S Chand, AdvantEdge Partners",Private Equity,"10,00,000",
1707,16/05/2016,BedBathMore,Consumer Internet,Home Decor eMarketplace,Mumbai,"Kinnevik Group, Rocket Internet",Private Equity,,
1708,17/05/2016,Murgency,Consumer Internet,Medical Emergency Response App,Mumbai,Rata Tata,Private Equity,,
1709,17/05/2016,Crownit,Consumer Internet,Mobile customer rewards management platform,Gurgaon,"Undisclosed investors, Accel Partners, Helion Venture Partners",Private Equity,,
1710,17/05/2016,Blinge,eCommerce,Apparel Rental platform,Mumbai,"Anupam Mittal, Anuj Srivastava, Ankit Nagori",Seed Funding,,
1711,18/05/2016,TheSmartQ,Consumer Internet,Food Ordering Mobile App,Bangalore,YourNest Angel Fund,Seed Funding,"2,50,000",
1712,18/05/2016,PurpleHealth,Consumer Internet,Online health-on-demand platform,Trivandrum,Katabole Technology Venture,Seed Funding,"1,00,000",
1713,18/05/2016,Fundamentor,Education,Aptitude Development Program,Pune,Subramanya SV,Seed Funding,,
1714,18/05/2016,EduPristine,Education,Online Certification Courses,Mumbai,"Kaizen Management Advisors, DeVry Inc",Private Equity,"1,00,00,000",
1715,18/05/2016,BhiveWorkspace,Reality,Co-Working Spaces,Bangalore,Blume Ventures,Private Equity,"10,00,000",
1716,18/05/2016,Parentlane,Consumer Internet,Parenting & Child Care app,Bangalore,"Sujeet Kumar, Aprameya, Sumit Jain, Subramanya Venkat, Venk, Ravi Machani, Hitesh Gupta, Rohit Choudhary",Seed Funding,,
1717,19/05/2016,Appie,Consumer Internet,Location-based offline retail discovery platform,Mumbai,Undisclosed investors,Seed Funding,"10,00,000",
1718,19/05/2016,Niki.ai,Technology,Artificial Intelligence Platform,Bangalore,Ratan Tata,Private Equity,,
1719,19/05/2016,TaxiVaxi,Consumer Internet,Cab Aggregating Platform,New Delhi,Undisclosed HNIs,Seed Funding,"5,00,000",
1720,19/05/2016,Veqta,Consumer Internet,On Demand Digital Sports Network,New Delhi,"Chatsworth Management, ITW Digital",Seed Funding,"5,00,000",
1721,20/05/2016,i2ifunding,Consumer Internet,Online Peer to Peer Funding,Noida,Undisclosed Investors,Seed Funding,"3,00,000",
1722,23/05/2016,EduRev,Consumer Internet,Online Learning Platform,Gurgaon,Pradeep Reddy Kamasan,Seed Funding,,
1723,23/05/2016,Hoppingo,Consumer Internet,Fashion Discovery platform,New Delhi,vCommission,Seed Funding,"89,000",
1724,24/05/2016,Eatonomist,Consumer Internet,Food Delivery Platform,Gurgaon,MCube Capital Advisors Pvt Ltd,Seed Funding,,
1725,24/05/2016,Goalwise,Consumer Internet,Online investment platform,Bangalore,Undisclosed HNIs,Seed Funding,"10,00,000",
1726,25/05/2016,Roast,Consumer Internet,Mobile entertainment App,New Delhi,Indian Angel Network,Seed Funding,,
1727,25/05/2016,Address Health,Healthcare,Pediatric Primary Healthcare Network,Bangalore,Gray Matters Capital,Private Equity,"15,00,000",
